{
  "runId": "us2-variant",
  "mode": "research",
  "moduleRef": { "id": "short_after_pump", "version": "0.1.0" },
  "overlayRefs": [{ "id": "early_exit_short_after_pump", "version": "0.1.0" }],
  "datasetRef": "pump-fixture-1m",
  "symbols": ["BTCUSDT"],
  "timeframe": "1m",
  "period": { "from": "2025-01-01T00:00:00Z", "to": "2025-01-01T00:30:00Z" },
  "riskProfileRef": { "id": "default_risk", "version": "1.0.0" },
  "executionProfileRef": { "id": "default_exec", "version": "1.0.0" },
  "seed": 12345,
  "metrics": ["pnl", "max_drawdown", "win_rate", "sharpe"],
  "robustnessChecks": ["walk_forward"]
}
